User_name,Review Title,Review Content,,app name
Suzie,Zoom Review,"Overall, I really like Zoom a lot.  It's now my main software tool for business and video conferences.  It's got great video quality, and it works great on my devices.  I also like that there isn't this huge ordeal to use it's system.  It's got a great reputation, and almost all of the people I do business with know what Zoom is, and also already use it, so that makes it extremely easy on me as well! ",,zoom
Robert,Easy To Use With Consistent Performance,A great solution for calls with more than 2 parties. Screen sharing is easy to use and can be passed between attendees quickly and easily. Online chat lets you post links for everyone to find/follow. Software is fast and doesn't require constant updating/downloading. Launches quickly.,,zoom
Anonymous,Ease Of Video Calling,"Zoom Meeting is a really good application for a new or existing user, You can dial PM for any particular person n u will be ib VC call. If you need to support remotly you can use the Zoom meeting. By using the chat option you can chat with private mode or you can broadcast your message.",,zoom
Lauren,"Perfect, user-friendly software","It would be great if it could just detect and connect audio and microphone automatically, but otherwise it has all the features you'd need, it's reliable, the quality is great and we also use zoom rooms, which is the easiest way to connect to meetings in all our conference rooms. I think it's a brilliant piece of software.",,zoom
Anonymous,"Best of the best, thank you for perfecting video chat","I originally started using Zoom with a client who had a client out of state. I was really impressed with the interface and brought it into my own team. It's allowed us to expand our customer base seamlessly out of town, and drastically cut down on unnecessary travel. ",,zoom
Ivan,Excellent meeting tool and also excellent for customer support!,"My overall experience is excellent, except for the two comments mentioned before, everything else is perfect and works flawlessly.",,zoom
Anonymous,Best Conference Call/Virtual Meeting Software Available,"Again, the issues I am highlighting are fairly nit picky as Zoom is vastly superior to the previous product we were using (Goto Meeting)",,zoom
Anonymous,Highly suggested for healthcare professionals since it is HIPAA Compliant,"Using Zoom was great especially for organizations that need to take HIPAA compliance into consideration. Since Zoom encrypts connections end to end, it works out great. It also was really easy to use their API, and it was very well documented. We rarely had issues with reliability through Zoom being used directly within our software. I thought it was very easy to use, and a much better option than most other video platforms. We also made great use of the reporting mechanism to know how much utilization we were getting out of Zoom. And the meetings that we generated across the organization, since we purchased an API subscription, were easy to customize for the settings on each meeting.   I do think generating meetings in Zoom is kind of inconvenient. There is a lot of information that must be copied and pasted into meeting invites and people often have questions about what link they should use. ",,zoom
Henry,Favorite software I use daily,"Solves the problem of meeting with people outside of the office with great quality audio, video and sharing. And constantly adding new, great features!",,zoom
Bob,Zoom works the best out all the systems I have tried.,"By using Zoom meetings, I am able to record for both, my audio podcasts and my video training programs by using one simple software. Prior to using Zoom, I was using two and sometimes three different platforms to accomplish the same thing I can do through Zoom!",,zoom
Keion L.,Reliable Conference Software,"My overall experience with Zoom is extremely good. The software is lightweight but very heavy hitting. It is packed with important features, controls and abilities. I feel this software one of the best on the market for audio video conferencing.  ",,zoom
Ben,Zoom is the Industry Standard for Me,"We have used Zoom for a little over a year and it has been an amazing experience.  We moved to Zoom from Webex, after people constantly having issues with that platform.  Zoom has been a night and day difference with user satisfaction sitting at a much higher rate than it was before.  ",,zoom
Francisco,The best tool for conference and group calls,"As I said earlier, Zoom is far superior to other tools in the market, even in its free version. We use it in our conference rooms and personal computers, with very good results in all scenarios (demos, support, remote daily meetings, etc.). Very user friendly and works really fast!",,zoom
Leif,"Great conferencing software, couple annoyances",Overall really positive experience with the software as well as the sales and support teams.,,zoom
Anonymous,"It actually works smoothly, unlike its competition","I could not be happier. Our institution has standardized on it, and it was one of the best I.T. business decisions we have made in the last 5 years.",,zoom
Andrew,Webconferencing for the agile workplace,"I use this product for countless meetings and I have always recommended it to co-workers. As a project manager, I often throw together meetings to have quick agile discussions with stakeholders and ZOOM allows me to do just that. Even external clients with no experience using ZOOM can access it and use it with little issue. As with all products, the more people are comfortable with the tools that ZOOM provides, the greater collaboration can be. Once people understand this, they find ZOOM to be one of the best tools for their day-to-day and begin scheduling their own web conferences. I think that alone demonstrates how useful ZOOM can be.",,zoom
David,A great alternative to GoToMeeting and WebEx,Zoom is a worthy competitor to GoToMeeting and Webex even if it still lacks some useful features. It does excel in large group environments and video screen participation. ,,zoom
James,Zoom video webinar meetings simplicity and power in meeting and webinar software,My overall experience has been very good and we have solidly used at least 2 other leaders in this category over the past 2-5 years.,,zoom
Jordan,Is it healthy to like a meeting and chat software this much?,Try the demo and see if it works best for your business. I know that I don't have any regrets.,,zoom
Amy,Very Easy and Convenient Platform for Remote Team Meetings & Presentations,"My experience with Zoom Meetings and Chat has been great. It's quickly become one of our team's most valuable collaboration tools. It feels like a shared meeting platform that's truly collaborative. Instead of one person starting and running a meeting, we can each step in and lead on-the-fly, naturally. So far, this platform feels more like your team being in the same room together than other professional meeting platforms.",,zoom
Amber Elizabeth,"Great for people that use technology, hard for some older folks ","While we survived on the free platform for a long while at one point, I wouldn't hesitate to recommend the paid version to others as the features really add a lot of robustness. Any business that hasn't caught on to video chats can try this product for free and learn what they are missing! ",,zoom
User_name,Review Title,Review Content,,app name
       Valentin     , Bad sales service ,"         Was contacted by a sales representative shortly after filling in the contact form on their website. We had a good discussion and agreed on a couple follow-up actions for them, including for example sharing the price rates for the extended list of international dial-in numbers. Never heard of them after that, no response to my follow-up requests. Neither by e-mail, linkedin (the sales rep. had sent me a connection request), or even their contact form... Strange behaviour, would not trust.       ",,go to meeting
       Anna K.     , Disappointed ,         Disappointed. Not easy to use at all.       ,,go to meeting
       Nichlas     , Incredible bad service ,"         Incredible bad service, Sales person wanted to sell me a year subscripsion, even after i told him its a one time set up, then he didn't want to talk to me anymore and hung up. I still havent heard back on my email from him.0 out of 5 stars if possible.       ",,go to meeting
User_name,Review Title,Review Content,,app name
             April immons         , Access into your partner's device. ,                 Access into your partner's device.L.E.G.I.O.N.H.A.C.K.S.5.6 AT. G.M.A.I.L.             ,,zoom
             Morten Funcloud         , Dobble billing and customer support ,                 Dobble billing and customer support Very hard to integrate to website             ,,zoom
             TJ (Estates) Limited         , We have used Zoom for remote viewing ,"                 We have used Zoom for remote viewing, and it has proven reliable and effective as a solution. In this post COVID world, it may be a great tool to continue using.             ",,zoom
             alf         , child abuse ,                 child abuse. i failed because i can't afford a camera             ,,zoom
             Ian          , Customer service is the most useless ,"                 Customer service is the most useless farce I've seen a business use.  It consists of a chat bot that only answers by sending you to their customer support page, which then sends you to the chat bot.  No one in their right mind should ever consider using this service.             ",,zoom
             Mohamed Hassan         , Zoom has superior functionality and is ,"                 Zoom has superior functionality and is super easy to use. We have been using it for years and we cannot recommend it enough. It has almost never let us down. Not even on a single call for years.The pricing is reasonable. Initially we were using a monthly subscription, then we moved to annual. We once had a delayed payment for over a month, but they were understanding enough and kept our premium service running until we paid.Again cannot recommend them enough for business use.             ",,zoom
             Dusko Nedic         , Zoom is a criminal organisation ,"                 Zoom is a criminal organisation. I have sent a number of e-mails and had a number of calls. I have paid for a business plan and they keep me on the basic one which is free.  I have already reported them to  the respective trade offices and request a charge back from my bank. Please, do not make the same mistake, find something else. Regards,Dusko             ",,zoom
             Ramon Cano Jr         , No customer Service - No support response ,                 We have a pro account with 8 paid host licenses.  We have had a billing issue since day 1 and I have been unable to get support on the issue.  I have two support tickets open with them and NO response.  I have now opened a third ticket. I have made multiple calls to their billing department but just stay on hold for a long time then eventually gets answered by an answering service and they take your info so they can call you back.  Been waiting for a call back for a month now.             ,,zoom
             Meredith Conder         , Poor service ,"                 Poor service, they didn't let you more than 40 mins for free!             ",,zoom
             Mohummed Uddin (Momo)         , longer calls make better reviews ,"                 rubbish they should make ordinary members be able to do longer video calls,and hey should tell you if somebody is typing or not.skype is so much better..             ",,zoom
             Bree G         , Connection drops frequently but you can ,                 Connection drops frequently but you can fix it if you turn off other devices and connections.             ,,zoom
             Naina Maraikar         , Customer Support is very worse ,                 Customer Support is very worse.  Struggling to get support for a week now.  No Response/Resolution yet.             ,,zoom
             Beni         , Can't Trust Them ,"                 The fact that they claim that you have 40min time limit when using the free version but then they cut you off suddenly after 30-35mins makes me not trust them. They straight up lie and then have the nerve to ask me to upgrade. I really wanted to get the Pro version, but NO thank you, I can't trust liars with my credit card.             ",,zoom
             Trevor Crago         , Constant crashes ,"                 So, when you try and enter a meeting, the computer app will crash 8 times. The phone app will crash at the same time. And youll totally miss the essential meeting because Zooms update crashed the entire computer.  Even then, the paid version is overpriced for what it is.  So thanks Zoom. Wish everyone still used Skype.             ",,zoom
             Mark         ," Hopeless support, double billing ","                 My experience matches that of most people, it seems. The product is good (except for constantly changing and confusing functionality and one day of no service at a couple of weeks ago). Customer service is utterly appalling, in fact seems to be non existent. They are billing me twice every month at the moment and will not reply to emails. Their robot chat facility on their website is utterly useless. Not sure want to do. I like the product, on the whole, but dont want to go on paying double for it every month, so time to start looking elsewhere, I think. What a shame, this company should be making a massive success of this product at the moment.             ",,zoom
             Peggy         , Poor Customer Service ,"                 Great video conferencing service. Very, very poor service. Never could get phone service to set up properly and asked for a refund and to cancel. Got a reply on May 9 that they were looking into it. Never heard back. Just realized that they charged me for a second month. Using Skype or Teams for my phone service. Starting to look for options to Zoom for video and webinars. I expect a company (no matter who fast they are growing) to be responsive.             ",,zoom
             Tony Reihl         , ZOOM IS A DECEITFUL.... Don't give them your money ,"                 This is what I wrote to PayPal and I am pretty confident I will get some of my money back. ""I made multiple attempts to change my zoom account from 2 licensees to 1 license throughout the month of May. These attempts included trying to use the website to change it which consistently resulted in an error that was being worked on. I called on two occasions and after sitting on hold for an unbelievable length of time, I was put through to an answering service that took my information and concern and said someone would be in touch with me. This never happened.  I also emailed the company twice and received no response. Ultimately, I wish I would have just canceled the subscription all together, which is what I did on the day I was notified they still charged my account for two licensees. I think that transaction is fraud, but since my request was to keep one license, then I am willing to pay that amount. Unfortunately, the ability to provide any proof of my attempts to rectify this problem can not be provided since, other than taking screen shots, everything is embedded in their site. I am disgusted in the terrible customer service and plan on filing a complaint with the BBB as well. Thank you.THIS COMPANY IS A SHAM AND THEIR CUSTOMER SERVICE IS THE WORST I HAVE EVER ENCOUNTERED IN MY LIFE!!! Use Google Duo, or WhatsApp. Their video quality is better and it is free.             ",,zoom
             Precious         , Zoom is TRASH ,"                 Zoom is TRASH. No customer service whatsoever.  No tech support.  Nothing.  Dont waste your money, or time.             ",,zoom
             Ruben J. Mullen         , I have had no problem getting support ,                 I have had no problem getting support when I needed it. Great service zoom..             ,,zoom
             GeorgieS         , Fine on Basic but appalling service when being paid ,"                 Fine on Basic but I registered and put DD in place for Pro. Zoom has failed to upgrade my account - even whilst taking two monthly payments and me sending multiple emails and speaking to several Zoom employees in Sales, Billing etc. Great idea - appalling service and response to communication. I am looking forward to them losing massive market share to a competitor.             ",,zoom
             April immons         , Access into your partner's device. ,                 Access into your partner's device.L.E.G.I.O.N.H.A.C.K.S.5.6 AT. G.M.A.I.L.             ,,zoom
             Morten Funcloud         , Dobble billing and customer support ,                 Dobble billing and customer support Very hard to integrate to website             ,,zoom
             TJ (Estates) Limited         , We have used Zoom for remote viewing ,"                 We have used Zoom for remote viewing, and it has proven reliable and effective as a solution. In this post COVID world, it may be a great tool to continue using.             ",,zoom
             alf         , child abuse ,                 child abuse. i failed because i can't afford a camera             ,,zoom
             Ian          , Customer service is the most useless ,"                 Customer service is the most useless farce I've seen a business use.  It consists of a chat bot that only answers by sending you to their customer support page, which then sends you to the chat bot.  No one in their right mind should ever consider using this service.             ",,zoom
             Mohamed Hassan         , Zoom has superior functionality and is ,"                 Zoom has superior functionality and is super easy to use. We have been using it for years and we cannot recommend it enough. It has almost never let us down. Not even on a single call for years.The pricing is reasonable. Initially we were using a monthly subscription, then we moved to annual. We once had a delayed payment for over a month, but they were understanding enough and kept our premium service running until we paid.Again cannot recommend them enough for business use.             ",,zoom
             Dusko Nedic         , Zoom is a criminal organisation ,"                 Zoom is a criminal organisation. I have sent a number of e-mails and had a number of calls. I have paid for a business plan and they keep me on the basic one which is free.  I have already reported them to  the respective trade offices and request a charge back from my bank. Please, do not make the same mistake, find something else. Regards,Dusko             ",,zoom
             Ramon Cano Jr         , No customer Service - No support response ,                 We have a pro account with 8 paid host licenses.  We have had a billing issue since day 1 and I have been unable to get support on the issue.  I have two support tickets open with them and NO response.  I have now opened a third ticket. I have made multiple calls to their billing department but just stay on hold for a long time then eventually gets answered by an answering service and they take your info so they can call you back.  Been waiting for a call back for a month now.             ,,zoom
             Meredith Conder         , Poor service ,"                 Poor service, they didn't let you more than 40 mins for free!             ",,zoom
             Mohummed Uddin (Momo)         , longer calls make better reviews ,"                 rubbish they should make ordinary members be able to do longer video calls,and hey should tell you if somebody is typing or not.skype is so much better..             ",,zoom
             Bree G         , Connection drops frequently but you can ,                 Connection drops frequently but you can fix it if you turn off other devices and connections.             ,,zoom
             Naina Maraikar         , Customer Support is very worse ,                 Customer Support is very worse.  Struggling to get support for a week now.  No Response/Resolution yet.             ,,zoom
             Beni         , Can't Trust Them ,"                 The fact that they claim that you have 40min time limit when using the free version but then they cut you off suddenly after 30-35mins makes me not trust them. They straight up lie and then have the nerve to ask me to upgrade. I really wanted to get the Pro version, but NO thank you, I can't trust liars with my credit card.             ",,zoom
             Trevor Crago         , Constant crashes ,"                 So, when you try and enter a meeting, the computer app will crash 8 times. The phone app will crash at the same time. And youll totally miss the essential meeting because Zooms update crashed the entire computer.  Even then, the paid version is overpriced for what it is.  So thanks Zoom. Wish everyone still used Skype.             ",,zoom
             Mark         ," Hopeless support, double billing ","                 My experience matches that of most people, it seems. The product is good (except for constantly changing and confusing functionality and one day of no service at a couple of weeks ago). Customer service is utterly appalling, in fact seems to be non existent. They are billing me twice every month at the moment and will not reply to emails. Their robot chat facility on their website is utterly useless. Not sure want to do. I like the product, on the whole, but dont want to go on paying double for it every month, so time to start looking elsewhere, I think. What a shame, this company should be making a massive success of this product at the moment.             ",,zoom
             Peggy         , Poor Customer Service ,"                 Great video conferencing service. Very, very poor service. Never could get phone service to set up properly and asked for a refund and to cancel. Got a reply on May 9 that they were looking into it. Never heard back. Just realized that they charged me for a second month. Using Skype or Teams for my phone service. Starting to look for options to Zoom for video and webinars. I expect a company (no matter who fast they are growing) to be responsive.             ",,zoom
             Tony Reihl         , ZOOM IS A DECEITFUL.... Don't give them your money ,"                 This is what I wrote to PayPal and I am pretty confident I will get some of my money back. ""I made multiple attempts to change my zoom account from 2 licensees to 1 license throughout the month of May. These attempts included trying to use the website to change it which consistently resulted in an error that was being worked on. I called on two occasions and after sitting on hold for an unbelievable length of time, I was put through to an answering service that took my information and concern and said someone would be in touch with me. This never happened.  I also emailed the company twice and received no response. Ultimately, I wish I would have just canceled the subscription all together, which is what I did on the day I was notified they still charged my account for two licensees. I think that transaction is fraud, but since my request was to keep one license, then I am willing to pay that amount. Unfortunately, the ability to provide any proof of my attempts to rectify this problem can not be provided since, other than taking screen shots, everything is embedded in their site. I am disgusted in the terrible customer service and plan on filing a complaint with the BBB as well. Thank you.THIS COMPANY IS A SHAM AND THEIR CUSTOMER SERVICE IS THE WORST I HAVE EVER ENCOUNTERED IN MY LIFE!!! Use Google Duo, or WhatsApp. Their video quality is better and it is free.             ",,zoom
             Precious         , Zoom is TRASH ,"                 Zoom is TRASH. No customer service whatsoever.  No tech support.  Nothing.  Dont waste your money, or time.             ",,zoom
             Ruben J. Mullen         , I have had no problem getting support ,                 I have had no problem getting support when I needed it. Great service zoom..             ,,zoom
             GeorgieS         , Fine on Basic but appalling service when being paid ,"                 Fine on Basic but I registered and put DD in place for Pro. Zoom has failed to upgrade my account - even whilst taking two monthly payments and me sending multiple emails and speaking to several Zoom employees in Sales, Billing etc. Great idea - appalling service and response to communication. I am looking forward to them losing massive market share to a competitor.             ",,zoom
             April immons         , Access into your partner's device. ,                 Access into your partner's device.L.E.G.I.O.N.H.A.C.K.S.5.6 AT. G.M.A.I.L.             ,,zoom
             Morten Funcloud         , Dobble billing and customer support ,                 Dobble billing and customer support Very hard to integrate to website             ,,zoom
             TJ (Estates) Limited         , We have used Zoom for remote viewing ,"                 We have used Zoom for remote viewing, and it has proven reliable and effective as a solution. In this post COVID world, it may be a great tool to continue using.             ",,zoom
             alf         , child abuse ,                 child abuse. i failed because i can't afford a camera             ,,zoom
             Ian          , Customer service is the most useless ,"                 Customer service is the most useless farce I've seen a business use.  It consists of a chat bot that only answers by sending you to their customer support page, which then sends you to the chat bot.  No one in their right mind should ever consider using this service.             ",,zoom
